?26239476391,Mart case - Case Untuk SERIES  Infinix Hot 60i | HOT 60 HOT 50i  Terbaru 2025 Case Pelindung hp Infinix Case INFINIX Lentur 2025 Protect Camera - Case Fashion - Softcase kekinian - Kesing hp INFINIX - Casing Keren 2025 - Case Murah - Aksesoris handphone,https://cf.shopee.co.id/file/id-11134207-7ra0l-mczwtcgtg6jb91,,https%3A%2F%2Fs.shopee.co.id%2Fan_redir%3F%26affiliate_id%3D11146330000%26sub_id%3D%7Bpsn%7D-%7Bclickid%7D-%7Bpublisher_site_url%7D-%7Bcampaign%7D-%26origin_link%3Dhttps%253A%252F%252Fshopee.co.id%252Funiversal-link%252Fproduct%252F1291292162%252F26239476391,https%3A%2F%2Fs.shopee.co.id%2Fan_redir%3F%26affiliate_id%3D11146330000%26sub_id%3D%7Bpsn%7D-%7Bclickid%7D-%7Bpublisher_site_url%7D-%7Bcampaign%7D-%26origin_link%3Dhttps%253A%252F%252Fshopee.co.id%252Funiversal-link%252Fproduct%252F1291292162%252F26239476391,SELAMAT DATANG DI MART CASE<br/>MENYEDIAKAN<br/><br/>SOFTCASE BERBAHAN TOP <br/>UPGARDE PRO CAMERA PERLINDUNGAN HP ANDA LEBIH MAKSIMAL <br/>DENGAN DESAIN MODEL YANG SANGAT KEREN DAN TREND <br/>MEMBERIKAN HASIL GAMBAR YANG SANGAT REAL DAN ISTIMEWA <br/>DENGAN TEKSTUR BAHAN SILICON YG LEMBUT DAN NYAMAN DI GENGGAM<br/><br/>(TYPE HP YANG TIDAK TERSEDIA BISA TANYAKAN ADMIN VIA CHAT]<br/><br/>CARA MEMESAN/CHECKOUT <br/>1] PILIH VARIASI MOTIF GAMBAR YG DI INGINKAN<br/>2] PILIH TIPE SESUAI HP KAMU DI KOLOM [TIPE HANDPHONE]<br/><br/>3] JIKA TIPE HP YANG KAMU INGIN TIDAK ADA DI DALAM KOLOM PILIHAN [TIPE HANDPHONE]<br/>   KAMU BISA CHAT ADMIN KAMI<br/><br/>ATTENTION <br/>JIKA TIDAK ADA KONFIRMASI TYPE HP AKAN KAMI KIRIM SECARA RANDOM<br/><br/><br/>Fitur softcase:<br/> Terdapat pelindung kamera<br/> Bahan tebal dari softcase biasa<br/> Bahan lembut dan nyaman digenggaman<br/> GAMBAR REAL dan istimewah<br/><br/>Fungsi softcase macaron pelindung kamera : <br/>- Melindungi handphone kamu dengan sempurna sisi pelindung yang kokoh sehingga 2 kali lipat melindungi handphone dari <br/>  benturan<br/>- Ketebalan case yang dapat melindungi sisi layar handphone sehingga layar tidak mudah retak saat jatuh<br/>- Pelindung/protection camera yang berfungsi sebagai perlindungan yang kuat agar kamera handphone tidak mudah tergores <br/>- setiap sisi tombol mudah di acces<br/> <br/><br/><br/>READY STOCK UNTUK<br/>-OPPO<br/>-REALME<br/>-SAMSUNG<br/>-VIVO<br/>-INFINIX<br/>-REDMI/XAIOMI<br/>-IPHONE<br/><br/>#MARTCASE #CASELUC #CASEMURAH #KESINGHP #CASECEWE #CASECOWO #CASETERBARU #BISAPAKEFOTOSENDIRI #CASECUSTOM,34900,20591,1,,,,Mobile & Gadgets,,Accessories,,"Cases, Covers, & Skins",IDR,NoBrand,0,
?24077452068,Toko Mainan L Sweet Ice Cream Magic Sand SH1085,https://cf.shopee.co.id/file/id-11134207-7r98y-lupsdtesvet8fe,,https://atid.me/adv.php?rk=00qc0q002qa9&url=https%3A%2F%2Fs.shopee.co.id%2Fan_redir%3F%26affiliate_id%3D11146330000%26sub_id%3D%7Bpsn%7D-%7Bclickid%7D-%7Bpublisher_site_url%7D-%7Bcampaign%7D-%26origin_link%3Dhttps%253A%252F%252Fshopee.co.id%252Funiversal-link%252Fproduct%252F872200374%252F24077452068&goods_id=?24077452068,https://atid.me/adv.php?rk=00qc0q002qa9&url=https%3A%2F%2Fs.shopee.co.id%2Fan_redir%3F%26affiliate_id%3D11146330000%26sub_id%3D%7Bpsn%7D-%7Bclickid%7D-%7Bpublisher_site_url%7D-%7Bcampaign%7D-%26origin_link%3Dhttps%253A%252F%252Fshopee.co.id%252Funiversal-link%252Fproduct%252F872200374%252F24077452068&goods_id=?24077452068,"Haloo teman Joys, selamat datang di Joysource.id<br/>Toko Mainan L Sweet Ice Cream Magic Sand SH1085 (BISA REQUEST)<br/>*SELAMA PERSEDIAAN MASIH ADA<br/><br/>Spesifikasi Produk :<br/>- 3pcs cetakan ice cream cone<br/>- 1pcs cetakan buah anggur<br/>- 2pcs Gelas piala dan 1pcs Piring <br/>- Pasir sekitar 125 gram (Warna Random)<br/>- Estimasi Ukuran Kemasan : 20 x 13 x 5 cm<br/>- Cocok untuk anak usia 3 tahun keatas<br/><br/>NB : <br/>1. Sebelum CHECKOUT tanyakan terlebih dahulu STOK kepada seller melalui chat. <br/>2. Lakukan video unboxing paket,foto resi, dan juga produk foto produk yg berkendala / rusak. <br/>3. Jika data komplain tidak lengkap , maka segala bentuk komplain yg masuk tidak bisa ditindaklanjuti atau dianggap tidak sah.<br/>4. Jika ingin melakikan komplain kerusakan packaging luar akibat pihak ekspedisi, harap lakukan langsung kepada pihak ekspedisi.<br/>5. Jika order warna tidak ada atau sold out dan customer tidak memberi warna cadangan, maka kami akan mengkonfirmasi 1x. Bila dalam 4jam tidak ada balasan, maka barang akan kami kirim dengan warna random.",15667,15667,1,,,,Mom & Baby,,Toys,,Sports & Outdoor Play,IDR,NoBrand,0,4
?27168403477,ROYAL CANIN KITTEN PERSIAN 10KG,https://cf.shopee.co.id/file/sg-11134201-7rep0-m2wa7bjfp8td74,,https://atid.me/adv.php?rk=00qc0q002qa9&url=https%3A%2F%2Fs.shopee.co.id%2Fan_redir%3F%26affiliate_id%3D11146330000%26sub_id%3D%7Bpsn%7D-%7Bclickid%7D-%7Bpublisher_site_url%7D-%7Bcampaign%7D-%26origin_link%3Dhttps%253A%252F%252Fshopee.co.id%252Funiversal-link%252Fproduct%252F457075914%252F27168403477&goods_id=?27168403477,https://atid.me/adv.php?rk=00qc0q002qa9&url=https%3A%2F%2Fs.shopee.co.id%2Fan_redir%3F%26affiliate_id%3D11146330000%26sub_id%3D%7Bpsn%7D-%7Bclickid%7D-%7Bpublisher_site_url%7D-%7Bcampaign%7D-%26origin_link%3Dhttps%253A%252F%252Fshopee.co.id%252Funiversal-link%252Fproduct%252F457075914%252F27168403477&goods_id=?27168403477,"ROYAL CANIN KITTEN PERSIAN<br/>*Makanan lengkap dan seimbang untuk kucing - Spesial anak kucing Persia (umur kurang dari 12 bulan) - Induk yang sedang hamil atau menyusui.<br/><br/>KINERJA PENCERNAAN<br/>Kombinasi nutrien spesifik yang membantu kesehatan pencernaan anak kucing persia. Protein yang sangat mudah dierna (LIP*), serat yang disesuaikan (termasuk psyllium) dan probiotik membantu promosi keseimbangan flora usus.<br/><br/>PERTAHANAN TUBUH ALAMI<br/>Kompleks antioksidan membantu mendukung pertahanan tubuh alami anak kucing Persia<br/><br/>KESEHATAN KULIT & RAMBUT<br/>Membantu mendukung peran pelindung kulit, memperlihatkan warna dan keindahan alami dari rambut. Diperkaya EPA & DHA.<br/><br/>SPECIAL BRACHYCEPHALIC JAW<br/>*L.I.P.: sumber protein berkualitas tinggi yang dipilih karena daya cernanya lebih dari 90 % (Royal Canin) untuk mempromosikan ketahanan sistem pencernaan dan kualitas feces yang baik.<br/><br/>RAHANG SPESIAL BRACHYCEPHALIC<br/>""Ruby 6"", sebuah kibble yang khusus diciptakan untuk memudahkan anak kucing Persia anda untuk mengambil dan mengunyahnya.",1942198,1942198,1,,,,Pets,,Pet Food,,Cat Food,IDR,Royal Canin,0,
?54954908093,DETTOL BODY WASH ANTI BAKTERI COOL 800/720g,https://cf.shopee.co.id/file/sg-11134201-824io-mf84dxtv52q46a,,https://atid.me/adv.php?rk=00qc0q002qa9&url=https%3A%2F%2Fs.shopee.co.id%2Fan_redir%3F%26affiliate_id%3D11146330000%26sub_id%3D%7Bpsn%7D-%7Bclickid%7D-%7Bpublisher_site_url%7D-%7Bcampaign%7D-%26origin_link%3Dhttps%253A%252F%252Fshopee.co.id%252Funiversal-link%252Fproduct%252F1577590473%252F54954908093&goods_id=?54954908093,https://atid.me/adv.php?rk=00qc0q002qa9&url=https%3A%2F%2Fs.shopee.co.id%2Fan_redir%3F%26affiliate_id%3D11146330000%26sub_id%3D%7Bpsn%7D-%7Bclickid%7D-%7Bpublisher_site_url%7D-%7Bcampaign%7D-%26origin_link%3Dhttps%253A%252F%252Fshopee.co.id%252Funiversal-link%252Fproduct%252F1577590473%252F54954908093&goods_id=?54954908093,Dettol Cool Bodywash merupakan sabun cair anti bakteri yang memberikan sensasi dingin menyegarkan dan memberikan perlindungan keluarga Anda setiap harinya dari kuman penyebab bau badan dengan harum mentol dan eucalyptus,41900,41900,1,,,,Beauty,,Bath & Body Care,,Body Wash & Soap,IDR,NoBrand,0,
?48802882090,top sale Sarung BHS Excellent Gold Motif E54 SKC SJ Hitam Kuning berkualitas,https://cf.shopee.co.id/file/sg-11134201-822z3-mi2t72v578jn86,,https://atid.me/adv.php?rk=00qc0q002qa9&url=https%3A%2F%2Fs.shopee.co.id%2Fan_redir%3F%26affiliate_id%3D11146330000%26sub_id%3D%7Bpsn%7D-%7Bclickid%7D-%7Bpublisher_site_url%7D-%7Bcampaign%7D-%26origin_link%3Dhttps%253A%252F%252Fshopee.co.id%252Funiversal-link%252Fproduct%252F1651777305%252F48802882090&goods_id=?48802882090,https://atid.me/adv.php?rk=00qc0q002qa9&url=https%3A%2F%2Fs.shopee.co.id%2Fan_redir%3F%26affiliate_id%3D11146330000%26sub_id%3D%7Bpsn%7D-%7Bclickid%7D-%7Bpublisher_site_url%7D-%7Bcampaign%7D-%26origin_link%3Dhttps%253A%252F%252Fshopee.co.id%252Funiversal-link%252Fproduct%252F1651777305%252F48802882090&goods_id=?48802882090,"Hallo<br/>selamat berkunjung di toko kami<br/><br/>Sarung BHS Excellent Gold Motif E54 SKC SJ Hitam Kuning<br/><br/>BHS, The Art of Craftsmanship Sejak 1953<br/><br/>Sarung BHS adalah simbol kemewahan dan keanggunan pria Indonesia sejak tahun 1953. Lebih dari sekadar kain, BHS adalah warisan budaya dan karya seni yang dipersembahkan dengan teknologi modern, menghasilkan sarung yang tidak hanya indah, tetapi juga tahan lama.<br/><br/>Spesifikasi Produk:<br/><br/>Model: BHS Excellent Gold Motif E54 SKC<br/><br/>Ukuran: 125 x 105 cm<br/><br/>Material: Mercerized<br/><br/>Kenapa harus BHS?<br/><br/>* Bahan Premium: Terbuat dari benang premium pilihan yang lembut, adem, dan nyaman dipakai sepanjang hari.<br/><br/>* Teknologi Khusus Anti Melar: Dirancang dengan metode pembuatan eksklusif BHS, sehingga sarung tetap terjaga bentuknya meski dicuci berulang kali.<br/><br/>* Desain Elegan: Motif khusus dengan corak perpaduan seni dan teknologi, menampilkan kesan mewah dan berkelas.<br/><br/>* Kualitas Terjamin Sejak 1953: Setiap helai sarung BHS kualitas tinggi adalah cerminan tradisi panjang craftsmanship yang tak lekang oleh waktu.<br/><br/>Cara Perawatan :<br/><br/>* Disarankan dry clean untuk hasil terbaik.<br/><br/>* Jika cuci manual, gunakan air bersuhu < 30 °C dan balik bagian dalam keluar.<br/><br/>* Jemur di tempat teduh, hindari sinar matahari langsung.<br/><br/>* Setrika dengan suhu rendah jika diperlukan.<br/><br/>* Simpan di tempat sejuk dan kering.<br/><br/>Pesan Sekarang!<br/><br/>Tingkatkan penampilan Anda dengan sarung premium yang memadukan tradisi, kemewahan, dan teknologi modern. Segera miliki Sarung BHS karena elegansi sejati tak pernah lekang oleh waktu.<br/><br/>Catatan: <br/><br/>* Transaksi yang masuk sebelum jam 12.00 WIB akan dikirim pada hari yang sama. <br/><br/>* Untuk hari Minggu/hari libur, pengiriman akan dilakukan pada hari operasional berikutnya. <br/><br/>Diproduksi oleh PT BEHAESTEX<br/>Perlu Diperhatikan<br/>baca deskripsi sebelum membeli<br/>membeli=setuju<br/>setelah barang diterima harap membuat video unboxing<br/>tidak menerima komplain jika tidak ada video unboxing",907000,907000,1,,,,Muslim Fashion,,Men Muslim Wear,,Sarong,IDR,NoBrand,0,
?57962044840,Sepatu badminton original Yonex comfort team sz 36,https://cf.shopee.co.id/file/id-11134207-822wj-mpc9qj7f67sy9a,,https://atid.me/adv.php?rk=00qc0q002qa9&url=https%3A%2F%2Fs.shopee.co.id%2Fan_redir%3F%26affiliate_id%3D11146330000%26sub_id%3D%7Bpsn%7D-%7Bclickid%7D-%7Bpublisher_site_url%7D-%7Bcampaign%7D-%26origin_link%3Dhttps%253A%252F%252Fshopee.co.id%252Funiversal-link%252Fproduct%252F587991710%252F57962044840&goods_id=?57962044840,https://atid.me/adv.php?rk=00qc0q002qa9&url=https%3A%2F%2Fs.shopee.co.id%2Fan_redir%3F%26affiliate_id%3D11146330000%26sub_id%3D%7Bpsn%7D-%7Bclickid%7D-%7Bpublisher_site_url%7D-%7Bcampaign%7D-%26origin_link%3Dhttps%253A%252F%252Fshopee.co.id%252Funiversal-link%252Fproduct%252F587991710%252F57962044840&goods_id=?57962044840,SEPATU BADMINTON ORIGINAL YONEX COMFORT TEAM<br/>SZ 36 INSOLE 220CM<br/>KONDISI GOOD DIJAMIN MANTAP,275000,275000,1,,,,Sports & Outdoors,,Sports Footwear,,Badminton Shoes,IDR,Yonex,0,0
?58008092721,RECOMMENDED Eden - Wallpaper Dinding Stiker Wallfoam 3D Sticker Dekorasi Kamar Rumah Murah High Quality TERMURAH!!!,https://cf.shopee.co.id/file/id-11134201-822wn-mmjt4z7lto1w5c,,https://atid.me/adv.php?rk=00qc0q002qa9&url=https%3A%2F%2Fs.shopee.co.id%2Fan_redir%3F%26affiliate_id%3D11146330000%26sub_id%3D%7Bpsn%7D-%7Bclickid%7D-%7Bpublisher_site_url%7D-%7Bcampaign%7D-%26origin_link%3Dhttps%253A%252F%252Fshopee.co.id%252Funiversal-link%252Fproduct%252F1774236464%252F58008092721&goods_id=?58008092721,https://atid.me/adv.php?rk=00qc0q002qa9&url=https%3A%2F%2Fs.shopee.co.id%2Fan_redir%3F%26affiliate_id%3D11146330000%26sub_id%3D%7Bpsn%7D-%7Bclickid%7D-%7Bpublisher_site_url%7D-%7Bcampaign%7D-%26origin_link%3Dhttps%253A%252F%252Fshopee.co.id%252Funiversal-link%252Fproduct%252F1774236464%252F58008092721&goods_id=?58008092721,"Informasi Penting:<br/><br/>- Pengiriman hanya tersedia via layanan Reguler.<br/>- Estimasi pengiriman: 34 hari kerja<br/>- Dengan membeli produk ini, Anda dianggap telah menyetujui semua ketentuan yang berlaku. Selamat datang di toko kami""Eden Selection""<br/><br/>Walpaper Dinding  wallpaper 3d foam bata 4mm<br/><br/>Ukuran: 70cm x 77cm<br/><br/>Bahan: Busa XPE, ketebalan 3mm tapi sangat ringan<br/><br/>-Dengan lem super lengket dan tahan lama<br/><br/>-Bahan dan lem ramah lingkungan<br/><br/>- Kepadatan dan elastisitas tinggi, dapat melindungi anak-anak dari benturan tembok/dinding<br/><br/>- Bahan tahan air dan mudah dibersihkan<br/><br/>-Model 3D, Pola di buat dengan sangat jelas/real<br/><br/>-Fleksibel dan mudah dipotong<br/><br/>-Sangat mudah dipasang, dapat di pasang sendiri di rumah<br/><br/>-Dapat disesuaikan sesuai keinginan anda<br/><br/>Cara menginstal dalam 3 langkah sederhana:<br/><br/>1. Ukur dinding yang akan ditempel dan potong stiker sesuai ukurannya<br/><br/>2. Bersihkan area yang akan ditempel dengan kain lembab<br/><br/>3. Lepaskan stiker dari kertas stiker, lalu tempelkan perlahan sambil di tekan<br/><br/>Komentar: Tidak cocok untuk dinding bergelombang, berdebu, atau sangat lembab. Catatan Tambahan:<br/><br/>- Semua pengajuan retur WAJIB disertai video unboxing. Tanpa video, retur tidak dapat diproses.<br/>- Jika stok gudang kosong, barang akan dikirim dari Pulau Jawa.",266599,266599,1,,,,Home & Living,,Decoration,,Wallpapers & Wall Stickers,IDR,NoBrand,0,0
